[
  {
    "row": "net_revenue",
    "period": "FY2020A",
    "value": 142.3,
    "unit": "USD_millions",
    "source": {
      "page": 12,
      "label": "Net revenue"
    },
    "confidence": 0.97,
    "checks": {
      "schema": true,
      "arithmetic": true,
      "two_pass": true
    },
    "review": false
  },
  {
    "row": "gross_profit",
    "period": "FY2020A",
    "value": 51.9,
    "unit": "USD_millions",
    "source": {
      "page": 12,
      "label": "Gross profit"
    },
    "confidence": 0.97,
    "checks": {
      "schema": true,
      "arithmetic": true,
      "two_pass": true
    },
    "review": false
  },
  {
    "row": "reported_ebitda",
    "period": "FY2020A",
    "value": 18.5,
    "unit": "USD_millions",
    "source": {
      "page": 12,
      "label": "Reported EBITDA"
    },
    "confidence": 0.97,
    "checks": {
      "schema": true,
      "arithmetic": true,
      "two_pass": true
    },
    "review": false
  },
  {
    "row": "ebitda_adjustments",
    "period": "FY2020A",
    "value": 3.2,
    "unit": "USD_millions",
    "source": {
      "page": 12,
      "label": "Adjustments to EBITDA"
    },
    "confidence": 0.97,
    "checks": {
      "schema": true,
      "arithmetic": true,
      "two_pass": true
    },
    "review": false
  },
  {
    "row": "adjusted_ebitda",
    "period": "FY2020A",
    "value": 21.7,
    "unit": "USD_millions",
    "source": {
      "page": 12,
      "label": "Adjusted EBITDA"
    },
    "confidence": 0.97,
    "checks": {
      "schema": true,
      "arithmetic": true,
      "two_pass": true
    },
    "review": false
  },
  {
    "row": "net_revenue",
    "period": "FY2021A",
    "value": 156.8,
    "unit": "USD_millions",
    "source": {
      "page": 12,
      "label": "Net revenue"
    },
    "confidence": 0.97,
    "checks": {
      "schema": true,
      "arithmetic": true,
      "two_pass": true
    },
    "review": false
  },
  {
    "row": "gross_profit",
    "period": "FY2021A",
    "value": 57.7,
    "unit": "USD_millions",
    "source": {
      "page": 12,
      "label": "Gross profit"
    },
    "confidence": 0.97,
    "checks": {
      "schema": true,
      "arithmetic": true,
      "two_pass": true
    },
    "review": false
  },
  {
    "row": "reported_ebitda",
    "period": "FY2021A",
    "value": 21.0,
    "unit": "USD_millions",
    "source": {
      "page": 12,
      "label": "Reported EBITDA"
    },
    "confidence": 0.97,
    "checks": {
      "schema": true,
      "arithmetic": true,
      "two_pass": true
    },
    "review": false
  },
  {
    "row": "ebitda_adjustments",
    "period": "FY2021A",
    "value": 2.8,
    "unit": "USD_millions",
    "source": {
      "page": 12,
      "label": "Adjustments to EBITDA"
    },
    "confidence": 0.97,
    "checks": {
      "schema": true,
      "arithmetic": true,
      "two_pass": true
    },
    "review": false
  },
  {
    "row": "adjusted_ebitda",
    "period": "FY2021A",
    "value": 23.8,
    "unit": "USD_millions",
    "source": {
      "page": 12,
      "label": "Adjusted EBITDA"
    },
    "confidence": 0.97,
    "checks": {
      "schema": true,
      "arithmetic": true,
      "two_pass": true
    },
    "review": false
  },
  {
    "row": "net_revenue",
    "period": "FY2022A",
    "value": 171.4,
    "unit": "USD_millions",
    "source": {
      "page": 12,
      "label": "Net revenue"
    },
    "confidence": 0.97,
    "checks": {
      "schema": true,
      "arithmetic": true,
      "two_pass": true
    },
    "review": false
  },
  {
    "row": "gross_profit",
    "period": "FY2022A",
    "value": 63.4,
    "unit": "USD_millions",
    "source": {
      "page": 12,
      "label": "Gross profit"
    },
    "confidence": 0.97,
    "checks": {
      "schema": true,
      "arithmetic": true,
      "two_pass": true
    },
    "review": false
  },
  {
    "row": "reported_ebitda",
    "period": "FY2022A",
    "value": 23.9,
    "unit": "USD_millions",
    "source": {
      "page": 12,
      "label": "Reported EBITDA"
    },
    "confidence": 0.97,
    "checks": {
      "schema": true,
      "arithmetic": true,
      "two_pass": true
    },
    "review": false
  },
  {
    "row": "ebitda_adjustments",
    "period": "FY2022A",
    "value": 4.1,
    "unit": "USD_millions",
    "source": {
      "page": 12,
      "label": "Adjustments to EBITDA"
    },
    "confidence": 0.97,
    "checks": {
      "schema": true,
      "arithmetic": true,
      "two_pass": true
    },
    "review": false
  },
  {
    "row": "adjusted_ebitda",
    "period": "FY2022A",
    "value": 28.0,
    "unit": "USD_millions",
    "source": {
      "page": 12,
      "label": "Adjusted EBITDA"
    },
    "confidence": 0.97,
    "checks": {
      "schema": true,
      "arithmetic": true,
      "two_pass": true
    },
    "review": false
  },
  {
    "row": "net_revenue",
    "period": "FY2023A",
    "value": 189.6,
    "unit": "USD_millions",
    "source": {
      "page": 12,
      "label": "Net revenue"
    },
    "confidence": 0.97,
    "checks": {
      "schema": true,
      "arithmetic": true,
      "two_pass": true
    },
    "review": false
  },
  {
    "row": "gross_profit",
    "period": "FY2023A",
    "value": 70.7,
    "unit": "USD_millions",
    "source": {
      "page": 12,
      "label": "Gross profit"
    },
    "confidence": 0.97,
    "checks": {
      "schema": true,
      "arithmetic": true,
      "two_pass": true
    },
    "review": false
  },
  {
    "row": "reported_ebitda",
    "period": "FY2023A",
    "value": 27.2,
    "unit": "USD_millions",
    "source": {
      "page": 12,
      "label": "Reported EBITDA"
    },
    "confidence": 0.97,
    "checks": {
      "schema": true,
      "arithmetic": true,
      "two_pass": true
    },
    "review": false
  },
  {
    "row": "ebitda_adjustments",
    "period": "FY2023A",
    "value": 5.1,
    "unit": "USD_millions",
    "source": {
      "page": 12,
      "label": "Adjustments to EBITDA"
    },
    "confidence": 0.55,
    "checks": {
      "schema": true,
      "arithmetic": false,
      "two_pass": false
    },
    "review": true
  },
  {
    "row": "adjusted_ebitda",
    "period": "FY2023A",
    "value": 32.3,
    "unit": "USD_millions",
    "source": {
      "page": 12,
      "label": "Adjusted EBITDA"
    },
    "confidence": 0.97,
    "checks": {
      "schema": true,
      "arithmetic": true,
      "two_pass": true
    },
    "review": false
  },
  {
    "row": "net_revenue",
    "period": "FY2024A",
    "value": 204.1,
    "unit": "USD_millions",
    "source": {
      "page": 12,
      "label": "Net revenue"
    },
    "confidence": 0.97,
    "checks": {
      "schema": true,
      "arithmetic": true,
      "two_pass": true
    },
    "review": false
  },
  {
    "row": "gross_profit",
    "period": "FY2024A",
    "value": 77.6,
    "unit": "USD_millions",
    "source": {
      "page": 12,
      "label": "Gross profit"
    },
    "confidence": 0.97,
    "checks": {
      "schema": true,
      "arithmetic": true,
      "two_pass": true
    },
    "review": false
  },
  {
    "row": "reported_ebitda",
    "period": "FY2024A",
    "value": 31.8,
    "unit": "USD_millions",
    "source": {
      "page": 12,
      "label": "Reported EBITDA"
    },
    "confidence": 0.97,
    "checks": {
      "schema": true,
      "arithmetic": true,
      "two_pass": true
    },
    "review": false
  },
  {
    "row": "ebitda_adjustments",
    "period": "FY2024A",
    "value": 3.6,
    "unit": "USD_millions",
    "source": {
      "page": 12,
      "label": "Adjustments to EBITDA"
    },
    "confidence": 0.97,
    "checks": {
      "schema": true,
      "arithmetic": true,
      "two_pass": true
    },
    "review": false
  },
  {
    "row": "adjusted_ebitda",
    "period": "FY2024A",
    "value": 35.4,
    "unit": "USD_millions",
    "source": {
      "page": 12,
      "label": "Adjusted EBITDA"
    },
    "confidence": 0.97,
    "checks": {
      "schema": true,
      "arithmetic": true,
      "two_pass": true
    },
    "review": false
  },
  {
    "row": "net_revenue",
    "period": "FY2025E",
    "value": 221.0,
    "unit": "USD_millions",
    "source": {
      "page": 13,
      "label": "Net revenue"
    },
    "confidence": 0.97,
    "checks": {
      "schema": true,
      "arithmetic": true,
      "two_pass": true
    },
    "review": false
  },
  {
    "row": "gross_profit",
    "period": "FY2025E",
    "value": 85.1,
    "unit": "USD_millions",
    "source": {
      "page": 13,
      "label": "Gross profit"
    },
    "confidence": 0.97,
    "checks": {
      "schema": true,
      "arithmetic": true,
      "two_pass": true
    },
    "review": false
  },
  {
    "row": "reported_ebitda",
    "period": "FY2025E",
    "value": 35.9,
    "unit": "USD_millions",
    "source": {
      "page": 13,
      "label": "Reported EBITDA"
    },
    "confidence": 0.97,
    "checks": {
      "schema": true,
      "arithmetic": true,
      "two_pass": true
    },
    "review": false
  },
  {
    "row": "ebitda_adjustments",
    "period": "FY2025E",
    "value": 2.0,
    "unit": "USD_millions",
    "source": {
      "page": 13,
      "label": "Adjustments to EBITDA"
    },
    "confidence": 0.97,
    "checks": {
      "schema": true,
      "arithmetic": true,
      "two_pass": true
    },
    "review": false
  },
  {
    "row": "adjusted_ebitda",
    "period": "FY2025E",
    "value": 37.9,
    "unit": "USD_millions",
    "source": {
      "page": 13,
      "label": "Adjusted EBITDA"
    },
    "confidence": 0.97,
    "checks": {
      "schema": true,
      "arithmetic": true,
      "two_pass": true
    },
    "review": false
  },
  {
    "row": "net_revenue",
    "period": "FY2026E",
    "value": 239.5,
    "unit": "USD_millions",
    "source": {
      "page": 13,
      "label": "Net revenue"
    },
    "confidence": 0.97,
    "checks": {
      "schema": true,
      "arithmetic": true,
      "two_pass": true
    },
    "review": false
  },
  {